{
  "schema_version": "authority_bundle.v4",
  "provenance_complete": true,
  "source_policy": {
    "source_policy_id": "repository-policy",
    "source_revision": "revision-1",
    "source_policy_ref": "repository-policy@revision-1",
    "content_encoding": "base64",
    "source_bytes_base64": "QWdlbnRzIG11c3QgdXNlIHJvbGUgcmVwb3NpdG9yeS1tYWludGFpbmVyIHRvIGNyZWF0ZSByZXBvc2l0b3J5IGZpbGVzLgpBZ2VudHMgbWF5IGNyZWF0ZSBmaWxlcyB1bmRlciBnZW5lcmF0ZWQvLgpBZ2VudHMgbXVzdCBub3QgY3JlYXRlIGZpbGVzIHVuZGVyIGdlbmVyYXRlZC9wcml2YXRlLy4=",
    "snapshot_hash": "sha256:ff5601216d1505cc8d8c9fb73fe3276d3a7852a083f302e8767e592ca1b3727f"
  },
  "policy_translation_commitment": {
    "schema_version": "policy_translation_commitment.v1",
    "source_policy_ref": "repository-policy@revision-1",
    "source_snapshot_hash": "sha256:ff5601216d1505cc8d8c9fb73fe3276d3a7852a083f302e8767e592ca1b3727f",
    "authority_ref": "repository-create-only@3.0.0",
    "capability_catalog": {
      "catalog_id": "waveframe.coding-agent.repository-change",
      "catalog_version": "3.0.0",
      "catalog_hash": "sha256:bd7fd23eb59b5521ef6780edec0667ce9b7ba9b5738dfa2701a575fb3efce930"
    },
    "customer_bindings": [],
    "clauses": [
      {
        "clause_id": "policy-clause-f7d301eec705aaa85360a4ddcc91d197d96136302e75c1731ed6d8656b683e22",
        "index": 0,
        "start_byte": 0,
        "end_byte": 71,
        "clause_bytes_base64": "QWdlbnRzIG11c3QgdXNlIHJvbGUgcmVwb3NpdG9yeS1tYWludGFpbmVyIHRvIGNyZWF0ZSByZXBvc2l0b3J5IGZpbGVzLgo=",
        "clause_hash": "sha256:061b27ecadd28facae2e6768910fb8c76e5c09852dee17721dcbcd1eaa80b17f",
        "customer_coverage_state": "Prepared for a compatible Guard runtime",
        "limitation_code": null,
        "customer_explanation": null,
        "controls": [
          {
            "candidate_control": {
              "control_type": "acting_role",
              "actor_kind": "autonomous_agent",
              "action": "create",
              "resource_kind": "repository_change",
              "fact_id": "actor.role",
              "operator": "==",
              "effect": "require",
              "enforcement_point": "waveframe.guard.repository-change.v2",
              "required_runtime_facts": [
                "actor.role",
                "actor.subject_kind",
                "proposal.action",
                "proposal.resource.kind"
              ],
              "value": {
                "kind": "source_literal",
                "value": "repository-maintainer",
                "canonical_value": "repository-maintainer",
                "start_byte": 21,
                "end_byte": 42,
                "literal_hash": "sha256:9d083daf15d2c3fceffeed7515861c9203bb5eef06dd0bbda744c1d5de1c02f1"
              },
              "candidate_control_id": "candidate-control-acfa80e799e3db5661214bd4b2c2a48275a0621af0a5963356d7436174ffa254"
            },
            "resolved_value": "repository-maintainer",
            "constraint_id": "constraint-7eec15c45ae4771aa4db3666fd9671744211f725a1f945fa4ca62b5c86f470e3",
            "human_confirmation": {
              "clause_id": "policy-clause-f7d301eec705aaa85360a4ddcc91d197d96136302e75c1731ed6d8656b683e22",
              "candidate_control_id": "candidate-control-acfa80e799e3db5661214bd4b2c2a48275a0621af0a5963356d7436174ffa254",
              "confirmed_by": "example-release-policy-owner",
              "confirmed_at": "2026-09-12T12:01:00Z",
              "confirmation_hash": "sha256:58c64d06320da9ae96d8452b7ab68a9aa65b67df78c812397ee33a9879fb9b40"
            },
            "customer_explanation": "The create action requires repository role 'repository-maintainer'. This role grants no operation. This policy is prepared to enforce these controls through a compatible Guard runtime. Create and modify have independent paths and action-wide roles. An absent action or missing matching allow grants no permission. A matching deny wins within the same action; rules never cross actions. Roles restrict an action and grant no paths. Creation requires exclusive creation of one new regular file under an existing parent in the selected workspace, without overwrite or parent creation. Guard must check filesystem state, not caller facts. This review does not establish deployment, a connected runtime, successful execution, or control over mutations outside Guard."
          }
        ],
        "residuals": [],
        "human_coverage_decision": {
          "clause_id": "policy-clause-f7d301eec705aaa85360a4ddcc91d197d96136302e75c1731ed6d8656b683e22",
          "coverage_status": "fully_represented",
          "reason_code": "human-confirmed-complete",
          "human_reason": null,
          "acknowledged_unrepresented": false,
          "confirmed_by": "example-release-policy-owner",
          "confirmed_at": "2026-09-12T12:02:00Z",
          "decision_hash": "sha256:f3c21e440cbce6bbf2684d98cbf6bbcab2325feab8d96068b430115e64b1a465"
        }
      },
      {
        "clause_id": "policy-clause-2532c0e8dca3a40a13b50b15eb50173c9deb85dae6b33a476b437fa66e5f122e",
        "index": 1,
        "start_byte": 71,
        "end_byte": 113,
        "clause_bytes_base64": "QWdlbnRzIG1heSBjcmVhdGUgZmlsZXMgdW5kZXIgZ2VuZXJhdGVkLy4K",
        "clause_hash": "sha256:9449ff5778cc5dfecae849f0e4cce2ab464713b9fc55e16eeccdf18e738ee1f5",
        "customer_coverage_state": "Prepared for a compatible Guard runtime",
        "limitation_code": null,
        "customer_explanation": null,
        "controls": [
          {
            "candidate_control": {
              "control_type": "prefix_path_access",
              "actor_kind": "autonomous_agent",
              "action": "create",
              "resource_kind": "repository_path",
              "fact_id": "proposal.resource.path",
              "operator": "starts_with",
              "effect": "allow",
              "enforcement_point": "waveframe.guard.repository-change.v2",
              "required_runtime_facts": [
                "actor.subject_kind",
                "proposal.action",
                "proposal.resource.kind",
                "proposal.resource.path"
              ],
              "value": {
                "kind": "source_literal",
                "value": "generated/",
                "canonical_value": "generated/",
                "start_byte": 101,
                "end_byte": 111,
                "literal_hash": "sha256:328fe672f05db7520ec99e35e96a0d0dbc98ceb7653fe51ad4f2b9474aa9ea5e"
              },
              "candidate_control_id": "candidate-control-86d477148f61eeb5547411efbfce9ce60edb311d854eacb6515cd24640901a89"
            },
            "resolved_value": "generated/",
            "constraint_id": "constraint-fdba1f306b184294c5c78fe3a5f577664e7c8f26c65861e3ccbb974acffb914d",
            "human_confirmation": {
              "clause_id": "policy-clause-2532c0e8dca3a40a13b50b15eb50173c9deb85dae6b33a476b437fa66e5f122e",
              "candidate_control_id": "candidate-control-86d477148f61eeb5547411efbfce9ce60edb311d854eacb6515cd24640901a89",
              "confirmed_by": "example-release-policy-owner",
              "confirmed_at": "2026-09-12T12:01:00Z",
              "confirmation_hash": "sha256:8299e7d77728e10232286cfd93003263fbbe2585b491d69a9c286da3b6c891d7"
            },
            "customer_explanation": "Automated agents may create files under 'generated/'. This policy is prepared to enforce these controls through a compatible Guard runtime. Create and modify have independent paths and action-wide roles. An absent action or missing matching allow grants no permission. A matching deny wins within the same action; rules never cross actions. Roles restrict an action and grant no paths. Creation requires exclusive creation of one new regular file under an existing parent in the selected workspace, without overwrite or parent creation. Guard must check filesystem state, not caller facts. This review does not establish deployment, a connected runtime, successful execution, or control over mutations outside Guard."
          }
        ],
        "residuals": [],
        "human_coverage_decision": {
          "clause_id": "policy-clause-2532c0e8dca3a40a13b50b15eb50173c9deb85dae6b33a476b437fa66e5f122e",
          "coverage_status": "fully_represented",
          "reason_code": "human-confirmed-complete",
          "human_reason": null,
          "acknowledged_unrepresented": false,
          "confirmed_by": "example-release-policy-owner",
          "confirmed_at": "2026-09-12T12:02:00Z",
          "decision_hash": "sha256:ed94b7fe17e801c69771894e9ecf547248a0a5ba04206e74bac0d81f7e9f8645"
        }
      },
      {
        "clause_id": "policy-clause-e9f35596a2e42d45817b4d363668a20e268c145e5e87b758444b6d3a1f2e8743",
        "index": 2,
        "start_byte": 113,
        "end_byte": 167,
        "clause_bytes_base64": "QWdlbnRzIG11c3Qgbm90IGNyZWF0ZSBmaWxlcyB1bmRlciBnZW5lcmF0ZWQvcHJpdmF0ZS8u",
        "clause_hash": "sha256:e231b6a271dad0e5e21571d94d0f43b6afb342beaaea96061a61787eb4d5eacf",
        "customer_coverage_state": "Prepared for a compatible Guard runtime",
        "limitation_code": null,
        "customer_explanation": null,
        "controls": [
          {
            "candidate_control": {
              "control_type": "prefix_path_access",
              "actor_kind": "autonomous_agent",
              "action": "create",
              "resource_kind": "repository_path",
              "fact_id": "proposal.resource.path",
              "operator": "starts_with",
              "effect": "deny",
              "enforcement_point": "waveframe.guard.repository-change.v2",
              "required_runtime_facts": [
                "actor.subject_kind",
                "proposal.action",
                "proposal.resource.kind",